[
  {
    "schema_version": "1.0",
    "id": "rss-demo-001",
    "feed_id": "feed-demo-economy",
    "publisher_id": "publisher-demo-01",
    "publisher_name": "가상 경제신문",
    "item_key": "url-v1:example.com/demo/rss-001",
    "source_item_id": null,
    "original_url": "https://example.com/demo/rss-001?utm_source=demo",
    "canonical_url": "https://example.com/demo/rss-001",
    "title": "[가상] 지역 기업 지원 정책 설명회 개최",
    "category": "economy",
    "author": null,
    "source_category": null,
    "rss_description": null,
    "published_at": "2026-10-22T09:00:00+09:00",
    "collected_at": "2026-10-22T09:10:00+09:00",
    "parse_status": "parsed",
    "body_status": "not_provided",
    "rights": {"collect": "allowed", "store": "allowed", "summarize": "allowed", "publish_summary": "allowed", "display_image": "unknown"},
    "is_demo": true
  },
  {
    "schema_version": "1.0",
    "id": "rss-demo-002",
    "feed_id": "feed-demo-politics",
    "publisher_id": "publisher-demo-02",
    "publisher_name": "가상 지역신문",
    "item_key": "guid-v1:demo-002",
    "source_item_id": "demo-002",
    "original_url": "https://example.com/demo/rss-002",
    "canonical_url": "https://example.com/demo/rss-002",
    "title": "[가상] 지역 예산 공개 절차 개선 논의",
    "category": "politics",
    "author": "가상 기자",
    "source_category": "지역정치",
    "rss_description": "직접 작성한 테스트 설명문입니다. AI 요약이 아닙니다.",
    "published_at": null,
    "collected_at": "2026-10-22T09:11:00+09:00",
    "parse_status": "partial",
    "body_status": "rss_excerpt",
    "rights": {"collect": "allowed", "store": "allowed", "summarize": "unknown", "publish_summary": "unknown", "display_image": "unknown"},
    "is_demo": true
  }
]
